{
    "id":  "safe-local-pool-20260522p-closeout",
    "createdAt":  "2026-05-22T20:58:09.7730782Z",
    "objective":  "Close out six-lane safe-local pool covering compliance workspace scope, tracking WebSocket scope, deliverability and content bounds, frontend public API origin guard, and DevOps validator portability.",
    "status":  "DONE",
    "owner":  "PROGRAM_MANAGER_AGENT",
    "filesInScope":  [
                         ".codex/backlog/queue.json",
                         ".codex/state/team-state.json",
                         ".codex/memory/active-work-items.md",
                         ".codex/memory/successful-fixes.md",
                         ".codex/memory/root-cause-history.md",
                         ".codex/memory/performance-bottlenecks.md",
                         ".codex/memory/security-findings.md",
                         ".codex/memory/technical-debt.md",
                         ".codex/memory/release-history.md"
                     ],
    "agents":  [
                   "019e5163-53a5-74b3-b469-bb41a740bf4c",
                   "019e5163-8ac3-7f23-b36b-6e98924b60d9",
                   "019e5163-d087-7860-954d-5fb2a8e2cd74",
                   "019e5164-1afe-7191-b530-fe4d2491cbc0",
                   "019e5164-5288-7120-a060-24ef13d80c55",
                   "019e5164-960a-7851-858f-8ed89016bc54"
               ],
    "validationPlan":  [
                           "Integrated backend reactor gate passed for foundation tracking deliverability content",
                           "Frontend lint build and API-client Playwright passed",
                           "Release evidence validators local release gate compose validators route validators artifact hygiene Codex validation and diff check passed"
                       ],
    "rollbackNotes":  "Preserve unrelated user changes; revert only this checkpoint scope if explicitly approved.",
    "blockers":  [

                 ],
    "nextAction":  "Refresh dashboard, release coordination lease, close workers, and run the next safe-local scan."
}
