{
    "id":  "codex-100-percent-backlog-memory-cleanup-20260523",
    "createdAt":  "2026-05-23T13:43:35.8952674Z",
    "objective":  "Build complete 100 percent readiness backlog and compact stale Codex memory",
    "status":  "DONE",
    "owner":  "DOCUMENTATION_ENGINEER",
    "filesInScope":  [

                     ],
    "agents":  [

               ],
    "validationPlan":  [

                       ],
    "rollbackNotes":  "Preserve unrelated user changes; revert only this checkpoint scope if explicitly approved.",
    "blockers":  [

                 ],
    "nextAction":  "Cleanup complete; promote delivery-policy-runtime-snapshot-contract or another READY item next."
}
