{
    "id":  "delivery-policy-ui-management-audit",
    "createdAt":  "2026-05-23T18:42:00.1780737Z",
    "objective":  "Add Admin UI for send-governance policy management and audit",
    "status":  "DONE",
    "owner":  "FRONTEND_OWNER",
    "filesInScope":  [
                         "frontend/src/app/(workspace)/campaigns/new/page.tsx",
                         "frontend/tests/e2e/campaign-engine.spec.ts",
                         "frontend/tests/e2e/admin.spec.ts",
                         "frontend/src/lib/campaign-studio-api.ts",
                         "frontend/src/lib/send-governance-policy-api.ts",
                         "services/content-service/src/main/java/com/legent/content/controller/SendGovernancePolicyController.java",
                         "services/content-service/src/main/java/com/legent/content/dto/EmailStudioDto.java",
                         ".codex/memory/active-work-items.md",
                         ".codex/memory/technical-debt.md",
                         ".codex/memory/unresolved-risks.md",
                         ".codex/memory/successful-fixes.md",
                         ".codex/backlog/queue.json",
                         ".codex/state/team-state.json",
                         ".codex/dashboards/team-dashboard.md"
                     ],
    "agents":  [
                   "CONTENT_SERVICE_OWNER",
                   "CAMPAIGN_SERVICE_OWNER",
                   "QA_ENGINEER"
               ],
    "validationPlan":  [
                           "cd frontend; npm run lint; npm run build:ci; .\\node_modules\\.bin\\playwright.cmd test tests/e2e/admin.spec.ts tests/e2e/campaign-engine.spec.ts --project=chromium --reporter=line"
                       ],
    "rollbackNotes":  "Preserve unrelated user changes; revert only this checkpoint scope if explicitly approved.",
    "blockers":  [

                 ],
    "nextAction":  "Policy management UI, campaign selection, and focused frontend validation complete."
}
