{
    "id":  "service-to-service-internal-route-identity-expansion",
    "createdAt":  "2026-05-24T14:21:53.7293622Z",
    "objective":  "Expand signed internal service identity to remaining internal routes",
    "status":  "DONE",
    "owner":  "SECURITY_ENGINEER",
    "filesInScope":  [
                         "shared/legent-common/src/main/java/com/legent/common/security/InternalServiceIdentity.java",
                         "shared/legent-common/src/test/java/com/legent/common/security/InternalServiceIdentityTest.java",
                         "services/deliverability-service/src/main/java/com/legent/deliverability/controller/SuppressionController.java",
                         "services/deliverability-service/src/test/java/com/legent/deliverability/controller/SuppressionControllerTest.java",
                         "services/campaign-service/src/main/java/com/legent/campaign/client/DeliverabilityReadinessClient.java",
                         "services/campaign-service/src/test/java/com/legent/campaign/client/DeliverabilityReadinessClientTest.java",
                         "services/audience-service/src/main/java/com/legent/audience/client/DeliverabilityServiceClient.java",
                         "services/audience-service/src/test/java/com/legent/audience/client/DeliverabilityServiceClientTest.java",
                         ".codex/backlog/queue.json",
                         ".codex/memory/active-work-items.md",
                         ".codex/memory/root-cause-history.md",
                         ".codex/memory/successful-fixes.md",
                         ".codex/memory/technical-debt.md",
                         ".codex/memory/unresolved-risks.md",
                         ".codex/state/team-state.json",
                         ".codex/dashboards/team-dashboard.md"
                     ],
    "agents":  [
                   "BACKEND_PLATFORM_OWNER",
                   "AUDIENCE_SERVICE_OWNER",
                   "CONTENT_SERVICE_OWNER",
                   "DELIVERABILITY_ENGINEER",
                   "QA_ENGINEER"
               ],
    "validationPlan":  [
                           ".\\mvnw.cmd -pl shared/legent-common",
                           "services/audience-service",
                           "services/content-service",
                           "services/deliverability-service",
                           "services/campaign-service",
                           "services/automation-service -am -Dtest=InternalServiceIdentityTest",
                           "AudienceResolutionChunkControllerTest",
                           "SecurityConfigTest",
                           "ContentControllerRbacTest",
                           "SuppressionControllerTest",
                           "AudienceResolutionClientTest",
                           "ContentServiceClientTest",
                           "AudienceDataExtensionClientTest -Dsurefire.failIfNoSpecifiedTests=false test",
                           "powershell -ExecutionPolicy Bypass -File scripts\\ops\\validate-route-map.ps1"
                       ],
    "rollbackNotes":  "Preserve unrelated user changes; revert only this checkpoint scope if explicitly approved.",
    "blockers":  [

                 ],
    "nextAction":  "Closed from 2026-05-24 audit DONE event; additional 2026-05-26 route coverage is tracked separately."
}
