{
    "id":  "ai-provider-contract-metering",
    "createdAt":  "2026-05-23T16:43:10.3933264Z",
    "objective":  "Add AI provider policy, disclosure, metering, and kill-switch contract",
    "status":  "DONE",
    "owner":  "FOUNDATION_SERVICE_OWNER",
    "filesInScope":  [
                         "services/foundation-service/src/main/java/com/legent/foundation/controller/PerformanceIntelligenceController.java",
                         "services/foundation-service/src/main/java/com/legent/foundation/service/performance/AiProviderContractMeteringService.java",
                         "services/foundation-service/src/main/java/com/legent/foundation/dto/performance/AiProviderContractRequest.java",
                         "services/foundation-service/src/main/java/com/legent/foundation/dto/performance/AiProviderContractResponse.java",
                         "services/foundation-service/src/main/java/com/legent/foundation/dto/performance/AiProviderMeteringRequest.java",
                         "services/foundation-service/src/main/java/com/legent/foundation/dto/performance/AiProviderMeteringResponse.java",
                         "services/foundation-service/src/main/resources/db/migration/V18__ai_provider_contract_metering.sql",
                         "services/foundation-service/src/test/java/com/legent/foundation/service/AiProviderContractMeteringServiceTest.java",
                         ".codex/backlog/queue.json",
                         ".codex/state/team-state.json",
                         ".codex/memory/active-work-items.md",
                         ".codex/memory/security-findings.md",
                         ".codex/memory/design-decisions.md",
                         ".codex/memory/technical-debt.md",
                         ".codex/dashboards/team-dashboard.md"
                     ],
    "agents":  [
                   "SECURITY_ENGINEER",
                   "PRODUCT_MANAGER_AGENT",
                   "TEST_ARCHITECT"
               ],
    "validationPlan":  [
                           ".\\mvnw.cmd -pl services/foundation-service -am \"-Dtest=AiContentAssistanceGovernanceServiceTest",
                           "OptimizationPerformanceServiceTest",
                           "OperationsAssistancePerformanceServiceTest\" \"-Dsurefire.failIfNoSpecifiedTests=false\" test"
                       ],
    "rollbackNotes":  "Preserve unrelated user changes; revert only this checkpoint scope if explicitly approved.",
    "blockers":  [

                 ],
    "nextAction":  "AI provider contract/metering complete locally; promote the next highest-score READY item after validation refresh."
}
