{
    "id":  "audience-internal-security-chain-coverage",
    "createdAt":  "2026-05-21T23:12:52.1245812Z",
    "objective":  "Add audience internal route security-chain coverage",
    "status":  "DONE",
    "owner":  "AUDIENCE_SERVICE_OWNER",
    "filesInScope":  [
                         "services/audience-service/src/main/java/com/legent/audience/config/SecurityConfig.java",
                         "services/audience-service/src/test/java/com/legent/audience/config/SecurityConfigTest.java",
                         ".codex/backlog/queue.json",
                         ".codex/state/team-state.json",
                         ".codex/memory/active-work-items.md",
                         ".codex/memory/security-findings.md",
                         ".codex/memory/successful-fixes.md",
                         ".codex/memory/release-history.md",
                         ".codex/checkpoints",
                         ".codex/audit/events/2026-05-21.jsonl",
                         ".codex/dashboards/team-dashboard.md",
                         ".codex/worktrees/leases/active-leases.json",
                         ".codex/threads/thread-registry.json"
                     ],
    "agents":  [
                   "SECURITY_ENGINEER",
                   "TEST_ARCHITECT"
               ],
    "validationPlan":  [
                           ".\\mvnw.cmd -pl services/audience-service -Dtest=SecurityConfigTest test",
                           ".\\mvnw.cmd -pl services/audience-service -am test",
                           "powershell -ExecutionPolicy Bypass -File scripts\\ops\\validate-repo-artifact-hygiene.ps1",
                           "powershell -ExecutionPolicy Bypass -File .codex\\utilities\\validate-codex-system.ps1",
                           "git diff --check -- services/audience-service .codex"
                       ],
    "rollbackNotes":  "Preserve unrelated user changes; revert only this checkpoint scope if explicitly approved.",
    "blockers":  [

                 ],
    "nextAction":  "Select the next highest-value safe local work item."
}
