{
    "id":  "overall-safe-local-pool-20260523",
    "createdAt":  "2026-05-23T10:06:31.9996682Z",
    "objective":  "Coordinate safe local work toward readiness without claiming external evidence",
    "status":  "DONE",
    "owner":  "PROGRAM_MANAGER_AGENT",
    "filesInScope":  [
                         ".codex/backlog/queue.json",
                         ".codex/state/team-state.json",
                         ".codex/memory/active-work-items.md",
                         ".codex/memory/blocked-items.md",
                         ".codex/memory/unresolved-risks.md",
                         ".codex/memory/security-findings.md",
                         ".codex/memory/technical-debt.md",
                         ".codex/memory/successful-fixes.md",
                         ".codex/memory/root-cause-history.md",
                         ".codex/memory/release-history.md",
                         ".codex/dashboards/team-dashboard.md",
                         ".codex/threads/thread-registry.json",
                         ".codex/worktrees/leases/active-leases.json",
                         ".codex/audit/events/2026-05-23.jsonl",
                         ".codex/checkpoints"
                     ],
    "agents":  [
                   "PROGRAM_MANAGER_AGENT",
                   "CTO_AGENT",
                   "QA_ENGINEER"
               ],
    "validationPlan":  [
                           "powershell -ExecutionPolicy Bypass -File .codex\\utilities\\validate-codex-system.ps1",
                           "powershell -ExecutionPolicy Bypass -File .codex\\utilities\\monitor-autonomous-org.ps1",
                           "git diff --check"
                       ],
    "rollbackNotes":  "Preserve unrelated user changes; revert only this checkpoint scope if explicitly approved.",
    "blockers":  [

                 ],
    "nextAction":  "Completed local cycle; all unblocked local work is done and remaining work is blocked by external evidence or policy decisions."
}
